The Lone Courier,	 Your players while out on the road find an overturned a cart. The horse in the field nearby and the dead body on the ground imply that he was attacked by bandits who pillaged the aforementioned cart. Upon checking the cart they discover an important letter in need of delivery to a towns nearby mayor.
The Champion's Call,	 The heroes are drinking in the tavern when a servant slips them a letter requesting their presence at <town official's place of business>. When they arrive he believes that someone is planning a devious plot at the upcoming banquet he's going to be throwing, and he wants the party there to disrupt whatever plot his rival factions may be planning
Falling Stars,	 A vast swathe of stars has disappeared from the sky. Soon after, monsters begin terrorizing the kingdom. Monsters that correspond to the constellations that disappeared. What caused them to fall? How can they be returned?
Planebreaker,	 Over the past several months, many planar disturbances have been logged. Analysis suggests planar shockwaves emanating from the Elemental Plane of Water. One night, a Sahuagin army attacks the site of a large magical focusing crystal. The leader raises his trident towards the crystal, and a beam of light shoots into the sky. The sky seems to begin filling with water...
Thief,	 A haunted house has appeared near a small village. The ghost inside is wailing about a thief who stole a powerful magical staff from her basement tomb.
Invasion of Spiders,	 The party meets a settlement of Dwarves, but strangely, they are living on the surface rather than underground. An army of Drow drove them from their home.
The Lost Tomb,	 While traversing a desert, the sand underneath the party begins to swirl. They get sucked into an underground tomb carved from sandstone.
The Contract,	 The party has been contracted by a local lord to take care of a rogue warrior who has been raiding his army encampments. The twist: When the party tracks him down, they discover their foe is, in fact, a Paladin of Freedom.
Frozen Wastelands,	 A snowstorm has been raging for months, seemingly centered on a certain mountain.
Shades of the Past,	 A misfired planar experiment sends the PCs through the Elemental Plane of Time, where they visit significant moments from their own backstories. Alternately: A powerful wizard uses divination and illusion magic to recreate key moments of the PC's backstories and attempts to use them to break them mentally.
The missing spy,	 A party member is bumped into on the street by someone unremarkable who simply excuses themselves and keeps walking. They later discover a small letter in one of their pockets. The letter details how a spy that was supposed to be reporting every so often has gone silent, and that they will be rewarded handsomely for their swift and discreet investigation.
Can't Stop the Roc,	 A Roc steals the caravan you are travelling with.
God-King,	 An aspect of a god takes the throne of a small kingdom near the one you are currently in.
Sweet Thief!,	 A thief is stealing all sweet pastries from bakeries around the city.
How did you know they were knights? Because they wore armor.,	 Two knights quarrel in the street over a mundane matter, Looks like it could get ugly.
Sickness in the court,	 A king or other ruling figure grows mortally ill.
Magnum Opus,	 An artist would like help creating their masterpiece, requiring a party of adventures to pose with a killed monster.
A killing Joke,	 An assassin masquerading as a jester has been killing a nobles every 5 days.
Plaguestoppers,	 A disease spreads across the land, the cure is known but difficult to obtain.
A Blue moon opening,	 A difficult to join guild is offering an opening.
42,	 A creature from another plane appears, insults the party, then leaves.
Honor in blood,	 A dying warrior desires death by combat.
Gallery of Rouges,	 Many of the towns undesirables have been banding together, the local authorities want this stopped.
Rubber Economy,	 Demand for rubber has gone through the roof, due to a fashion trend.
Free for all,	 A gem mine collapses suspiciously, and its contents have been declared free for all.
Gorgonzola Cheese,	 A new type of cheese has been developed, Gourmets would like to know if it is poisonous.
...And the worlds finest wine,	 Rich Nobles want rare liquor from around the kingdom for an upcoming party.
Gon' Fishin',	 The price of fish is up, now is the time to buy a rod.
Itemfinder,	 A specific treasure is desired, a local wizard is willing to help discern its location.
Not the Bees!,	 A bee keeper is looking for a few new queens.
God of colors,	 Dyes are in demand, due to a new religious craze.
A sharp order,	 A dragon needs somebody to file down its claws.
Gift of the gab,	 Crafting guilds are not cooperating and intermediates can make a lot of money.
A hole is a hole,	 You fall into a pitfall trap, something interesting is at the bottom of it.
To train them is my cause,	 The barracks need strong fighters to help train troops.
I don't remember them,	 You receive a letter claiming a member of the party is owed inheritance.
The Ogre and the Goblins,	 Recently a nearby town has lost all contact with the outside world. When the PCs go to investigate they discover that an ogre is holding the town hostage and letting no one leave under any circumstance unless unreasonable demand is met. If the PCs set out into the surrounding woods they can find the ogre's cave. Twist: the ogre doesn't want to do this and has been tricked into terrorizing the town by some goblins who want the town for nefarious purpose. The ogre will help fight the goblins if the PCs try to win it's freedom. 2nd Twist: the ogre is actually highly intelligent and is controlling the goblins. He betrays the PCs at a critical moment during the fight.
The RC Knight,	 Upon crossing a bridge, the party encounters a knight dressed in black, challenging them to battle, saying "None shall pass." After the battle begins, every round the party has a chance to notice that the knight is in fact an automaton being controlled by some children hiding in the bushes nearby. Upon being noticed the children have the knight pull the old "Pay no attention to the man behind the curtain" bit. "Your opponent is over here!", etc.
the smiling figure,	 In the midst of night the party is arrested and placed in one of 4 cages, each containing 16 people. the cages are surrounding a small clay figure like this one (http://i.imgur.com/3TB3SqI.jpg) they manage to escape yet they are stalked by a shadow. twist time: shadow is the spirit of one of the pc's that is trying to warn the party that whatever came out of the clay figure is controlling his body
The Man in The Hair Piece,	 It turns out it was actually Bruce Willis the whole time.
